{
  "schema_version": "2.1",
  "project": {
    "id": "案例D",
    "name": "案例D（權利變換示範）",
    "case_type": "danger_building"
  },
  "input": {
    "site": {
      "site_area_sqm": 1500.0,
      "plaza_area_sqm": 0.0,
      "far": 2.4,
      "bonus_ratio": 0.4,
      "tdr_transfer_sqm": 1080.0
    },
    "building": {
      "public_ratio": 0.34,
      "stair_hall_exempt_pct": 5,
      "balcony_exempt_pct": 10,
      "unit_count": 48
    },
    "floors": [
      {
        "enabled": true,
        "level": "B1F",
        "floor_area_sqm": 1300.0,
        "counted_far_sqm": 0.0,
        "stair_hall_sqm": 0.0,
        "safety_stair_sqm": 0.0,
        "balcony_sqm": 0.0
      },
      {
        "enabled": true,
        "level": "B2F",
        "floor_area_sqm": 1300.0,
        "counted_far_sqm": 0.0,
        "stair_hall_sqm": 0.0,
        "safety_stair_sqm": 0.0,
        "balcony_sqm": 0.0
      },
      {
        "enabled": true,
        "level": "B3F",
        "floor_area_sqm": 1300.0,
        "counted_far_sqm": 0.0,
        "stair_hall_sqm": 0.0,
        "safety_stair_sqm": 0.0,
        "balcony_sqm": 0.0
      },
      {
        "enabled": true,
        "level": "1F",
        "floor_area_sqm": 750.0,
        "counted_far_sqm": 0.0,
        "stair_hall_sqm": 75.0,
        "safety_stair_sqm": 235.0,
        "balcony_sqm": 0.0
      },
      {
        "enabled": true,
        "level": "2F",
        "floor_area_sqm": 430.0,
        "counted_far_sqm": 0.0,
        "stair_hall_sqm": 21.5,
        "safety_stair_sqm": 178.0,
        "balcony_sqm": 43.0
      },
      {
        "enabled": true,
        "level": "3F",
        "floor_area_sqm": 500.0,
        "counted_far_sqm": 0.0,
        "stair_hall_sqm": 25.0,
        "safety_stair_sqm": 40.0,
        "balcony_sqm": 50.0
      },
      {
        "enabled": true,
        "level": "4F",
        "floor_area_sqm": 500.0,
        "counted_far_sqm": 0.0,
        "stair_hall_sqm": 25.0,
        "safety_stair_sqm": 40.0,
        "balcony_sqm": 50.0
      },
      {
        "enabled": true,
        "level": "5F",
        "floor_area_sqm": 500.0,
        "counted_far_sqm": 0.0,
        "stair_hall_sqm": 25.0,
        "safety_stair_sqm": 40.0,
        "balcony_sqm": 50.0
      },
      {
        "enabled": true,
        "level": "6F",
        "floor_area_sqm": 500.0,
        "counted_far_sqm": 0.0,
        "stair_hall_sqm": 25.0,
        "safety_stair_sqm": 40.0,
        "balcony_sqm": 50.0
      },
      {
        "enabled": true,
        "level": "7F",
        "floor_area_sqm": 500.0,
        "counted_far_sqm": 0.0,
        "stair_hall_sqm": 25.0,
        "safety_stair_sqm": 40.0,
        "balcony_sqm": 50.0
      },
      {
        "enabled": true,
        "level": "8F",
        "floor_area_sqm": 500.0,
        "counted_far_sqm": 0.0,
        "stair_hall_sqm": 25.0,
        "safety_stair_sqm": 40.0,
        "balcony_sqm": 50.0
      },
      {
        "enabled": true,
        "level": "9F",
        "floor_area_sqm": 500.0,
        "counted_far_sqm": 0.0,
        "stair_hall_sqm": 25.0,
        "safety_stair_sqm": 40.0,
        "balcony_sqm": 50.0
      },
      {
        "enabled": true,
        "level": "10F",
        "floor_area_sqm": 500.0,
        "counted_far_sqm": 0.0,
        "stair_hall_sqm": 25.0,
        "safety_stair_sqm": 40.0,
        "balcony_sqm": 50.0
      },
      {
        "enabled": true,
        "level": "11F",
        "floor_area_sqm": 500.0,
        "counted_far_sqm": 0.0,
        "stair_hall_sqm": 25.0,
        "safety_stair_sqm": 40.0,
        "balcony_sqm": 50.0
      },
      {
        "enabled": true,
        "level": "12F",
        "floor_area_sqm": 500.0,
        "counted_far_sqm": 0.0,
        "stair_hall_sqm": 25.0,
        "safety_stair_sqm": 40.0,
        "balcony_sqm": 50.0
      },
      {
        "enabled": true,
        "level": "13F",
        "floor_area_sqm": 500.0,
        "counted_far_sqm": 0.0,
        "stair_hall_sqm": 25.0,
        "safety_stair_sqm": 40.0,
        "balcony_sqm": 50.0
      },
      {
        "enabled": true,
        "level": "14F",
        "floor_area_sqm": 500.0,
        "counted_far_sqm": 0.0,
        "stair_hall_sqm": 25.0,
        "safety_stair_sqm": 40.0,
        "balcony_sqm": 50.0
      },
      {
        "enabled": true,
        "level": "15F",
        "floor_area_sqm": 500.0,
        "counted_far_sqm": 0.0,
        "stair_hall_sqm": 25.0,
        "safety_stair_sqm": 40.0,
        "balcony_sqm": 50.0
      },
      {
        "enabled": true,
        "level": "R1F",
        "floor_area_sqm": 94.0,
        "counted_far_sqm": 0.0,
        "stair_hall_sqm": 0.0,
        "safety_stair_sqm": 0.0,
        "balcony_sqm": 0.0
      }
    ],
    "finance": {
      "residential_price": 65.0,
      "shop_area": 90.0,
      "shop_price": 100.0,
      "parking_count": 78,
      "parking_price": 230.0,
      "construction_price": 20.0
    },
    "owners": [
      {
        "owner_id": "W01",
        "land_share": 0.020833,
        "pre_building_area_sqm": 0.0,
        "pre_value": 1276.17,
        "consent": "agreed",
        "min_unit_eligible": true,
        "selected_value": 2800.0
      },
      {
        "owner_id": "W02",
        "land_share": 0.020833,
        "pre_building_area_sqm": 0.0,
        "pre_value": 1276.17,
        "consent": "agreed",
        "min_unit_eligible": true,
        "selected_value": 2600.0
      },
      {
        "owner_id": "W03",
        "land_share": 0.020833,
        "pre_building_area_sqm": 0.0,
        "pre_value": 1276.17,
        "consent": "agreed",
        "min_unit_eligible": true
      },
      {
        "owner_id": "W04",
        "land_share": 0.020833,
        "pre_building_area_sqm": 0.0,
        "pre_value": 1276.17,
        "consent": "agreed",
        "min_unit_eligible": true
      },
      {
        "owner_id": "W05",
        "land_share": 0.020833,
        "pre_building_area_sqm": 0.0,
        "pre_value": 708.98,
        "consent": "agreed",
        "min_unit_eligible": true
      },
      {
        "owner_id": "W06",
        "land_share": 0.020833,
        "pre_building_area_sqm": 0.0,
        "pre_value": 708.98,
        "consent": "agreed",
        "min_unit_eligible": true
      },
      {
        "owner_id": "W07",
        "land_share": 0.020833,
        "pre_building_area_sqm": 0.0,
        "pre_value": 708.98,
        "consent": "agreed",
        "min_unit_eligible": true
      },
      {
        "owner_id": "W08",
        "land_share": 0.020833,
        "pre_building_area_sqm": 0.0,
        "pre_value": 708.98,
        "consent": "agreed",
        "min_unit_eligible": true
      },
      {
        "owner_id": "W09",
        "land_share": 0.020833,
        "pre_building_area_sqm": 0.0,
        "pre_value": 708.98,
        "consent": "agreed",
        "min_unit_eligible": true
      },
      {
        "owner_id": "W10",
        "land_share": 0.020833,
        "pre_building_area_sqm": 0.0,
        "pre_value": 708.98,
        "consent": "agreed",
        "min_unit_eligible": true
      },
      {
        "owner_id": "W11",
        "land_share": 0.020833,
        "pre_building_area_sqm": 0.0,
        "pre_value": 708.98,
        "consent": "agreed",
        "min_unit_eligible": true
      },
      {
        "owner_id": "W12",
        "land_share": 0.020833,
        "pre_building_area_sqm": 0.0,
        "pre_value": 708.98,
        "consent": "agreed",
        "min_unit_eligible": true
      },
      {
        "owner_id": "W13",
        "land_share": 0.020833,
        "pre_building_area_sqm": 0.0,
        "pre_value": 708.98,
        "consent": "agreed",
        "min_unit_eligible": true
      },
      {
        "owner_id": "W14",
        "land_share": 0.020833,
        "pre_building_area_sqm": 0.0,
        "pre_value": 708.98,
        "consent": "agreed",
        "min_unit_eligible": true
      },
      {
        "owner_id": "W15",
        "land_share": 0.020833,
        "pre_building_area_sqm": 0.0,
        "pre_value": 708.98,
        "consent": "agreed",
        "min_unit_eligible": true
      },
      {
        "owner_id": "W16",
        "land_share": 0.020833,
        "pre_building_area_sqm": 0.0,
        "pre_value": 708.98,
        "consent": "agreed",
        "min_unit_eligible": true
      },
      {
        "owner_id": "W17",
        "land_share": 0.020833,
        "pre_building_area_sqm": 0.0,
        "pre_value": 708.98,
        "consent": "agreed",
        "min_unit_eligible": true
      },
      {
        "owner_id": "W18",
        "land_share": 0.020833,
        "pre_building_area_sqm": 0.0,
        "pre_value": 708.98,
        "consent": "agreed",
        "min_unit_eligible": true
      },
      {
        "owner_id": "W19",
        "land_share": 0.020833,
        "pre_building_area_sqm": 0.0,
        "pre_value": 708.98,
        "consent": "agreed",
        "min_unit_eligible": true
      },
      {
        "owner_id": "W20",
        "land_share": 0.020833,
        "pre_building_area_sqm": 0.0,
        "pre_value": 708.98,
        "consent": "agreed",
        "min_unit_eligible": true
      },
      {
        "owner_id": "W21",
        "land_share": 0.020833,
        "pre_building_area_sqm": 0.0,
        "pre_value": 708.98,
        "consent": "agreed",
        "min_unit_eligible": true
      },
      {
        "owner_id": "W22",
        "land_share": 0.020833,
        "pre_building_area_sqm": 0.0,
        "pre_value": 708.98,
        "consent": "agreed",
        "min_unit_eligible": true
      },
      {
        "owner_id": "W23",
        "land_share": 0.020833,
        "pre_building_area_sqm": 0.0,
        "pre_value": 708.98,
        "consent": "agreed",
        "min_unit_eligible": true
      },
      {
        "owner_id": "W24",
        "land_share": 0.020833,
        "pre_building_area_sqm": 0.0,
        "pre_value": 708.98,
        "consent": "agreed",
        "min_unit_eligible": true
      },
      {
        "owner_id": "W25",